{
  "$schema": "https://json-schema.org/draft/2020-12/schema",
  "$id": "https://malaquias.local/schemas/job.schema.json",
  "title": "Vacante normalizada",
  "type": "object",
  "additionalProperties": false,
  "required": ["schema_version", "id", "title", "language", "raw_text", "criteria"],
  "properties": {
    "schema_version": { "const": "1.0" },
    "id": { "type": "string", "minLength": 1 },
    "title": { "type": "string", "minLength": 1 },
    "language": { "type": "string", "minLength": 2 },
    "location": { "type": ["string", "null"] },
    "professional_family": { "type": ["string", "null"] },
    "source": {
      "type": "object",
      "additionalProperties": false,
      "required": ["source_id"],
      "properties": {
        "source_id": { "type": "string" },
        "source_url": { "type": ["string", "null"], "format": "uri" },
        "captured_at": { "type": ["string", "null"], "format": "date-time" },
        "license": { "type": ["string", "null"] }
      }
    },
    "raw_text": { "type": "string", "minLength": 20 },
    "criteria": {
      "type": "array",
      "items": { "$ref": "#/$defs/criterion" }
    }
  },
  "$defs": {
    "criterion": {
      "type": "object",
      "additionalProperties": false,
      "required": ["id", "label", "priority", "evaluable_in_cv"],
      "properties": {
        "id": { "type": "string", "minLength": 1 },
        "label": { "type": "string", "minLength": 2 },
        "priority": {
          "enum": ["required", "important", "preferred", "not_evaluable"]
        },
        "evaluable_in_cv": { "type": "boolean" },
        "equivalences": {
          "type": "array",
          "items": { "type": "string", "minLength": 1 },
          "default": []
        },
        "evidence_rule": { "type": ["string", "null"] },
        "minimum": { "type": ["string", "number", "null"] },
        "missing_policy": {
          "enum": ["unknown", "review"],
          "default": "unknown"
        }
      }
    }
  }
}
